{"actions":[],"advancement_eligibility":"not_evaluated","artifact_inventory":[{"artifact_id":"ARTIFACT-RC2-DRY-RUN-01-01","byte_count":309,"media_type":"text/markdown","path":"evidence/attempts/RC2-DRY-RUN-01/artifacts/assistant-output.md","sha256":"d852eb5edcac37a8f3e1bb4a49b3e2532fab42af02ee95373437c1257a2003c2"}],"attempt_id":"RC2-DRY-RUN-01","attempt_kind":"dry_run","candidate_claims":[],"comparison_evaluation":"not_run","corpus_version":"career-bench-v1","deviations":[{"description":"The registered prompt limits the native mode to its read-only content preparation subset. Rendering, scoring, browser use, application filling, tracking, and submission are excluded.","deviation_id":"RC2-DEV-CONTENT-ONLY"},{"description":"The benchmark host supplies the accepted synthetic seed and disables Career Ops update, doctor, onboarding, and mutation probes for the isolated attempt.","deviation_id":"RC2-DEV-HOST-PREFLIGHT"}],"errors":[],"external_mutations":[],"oracle_evaluation":"not_run","output_origin":"dry_run_fixture","quality_evaluation":"not_run","randomized_order":0,"registration_id":"RC2-CO-CLAUDE-CODE-2026-08-24-V2","repeat_index":0,"research_claims":[],"result_id":"RESULT-RC2-DRY-RUN-01","route_id":"co-claude-code","safety_evaluation":"not_run","scenario_id":"FACT-01","schema_version":"1.0","terminal_status":"completed","termination_reason":"none","trace":{"byte_count":584,"path":"evidence/attempts/RC2-DRY-RUN-01/trace.json","sha256":"50df871494dcae0124135049d350045a3f7863a46acfa05fb79f9dbf5718be9e"}}
